slug,latin_name,suggestion,status,source_url,license,saved_to
cedrobium-laportei,Cedrobium laportei,https://inaturalist-open-data.s3.amazonaws.com/photos/10584636/medium.jpg,downloaded,https://inaturalist-open-data.s3.amazonaws.com/photos/10584636/medium.jpg,agent-suggested,data/organism_photos/cedrobium-laportei.jpg
neolecanium-cornuparvum,Neolecanium cornuparvum / Coccidae,Close-up photo of magnolia twig showing brown dome-shaped scale insects against the grey bark.,downloaded,https://inaturalist-open-data.s3.amazonaws.com/photos/9035715/medium.jpeg,cc-by-nc,data/organism_photos/neolecanium-cornuparvum.jpg
qualitative,qualitative,photo of a caterpillar on Styphnolobium japonicum foliage in Amsterdam,skipped-non-species,,,
roosting-garden-birds-in-winter,,photo of small garden birds roosting in a Cupressocyparis hedge in Amsterdam in winter,skipped-non-species,,,
stomaphis-yanonis-aphididae,"Stomaphis yanonis, Aphididae",photo of a Stomaphis colony on Zelkova bark showing characteristic ant tending,downloaded,https://inaturalist-open-data.s3.amazonaws.com/photos/444767976/medium.jpeg,cc-by-nc,data/organism_photos/stomaphis-yanonis-aphididae.jpg
